tweet_id,full_text,name,retweet_count,favorite_count,source,normalized_numerator,normalized_denominator,img_num,breed,expanded_urls,jpg_url,dog_stage
830097400375152640,"Meet Samson. He's absolute fluffy perfection. Easily 13/10, but he needs your help. Click the link to find out more

https://t.co/z82hCtwhpn https://t.co/KoWrMkbMbW",Samson,3455,10804,Twitter for iPhone,13.0,10.0,4,Toy Poodle,"https://www.gofundme.com/sick-baby-samson,https://twitter.com/dog_rates/status/830097400375152640/photo/1,https://twitter.com/dog_rates/status/830097400375152640/photo/1,https://twitter.com/dog_rates/status/830097400375152640/photo/1,https://twitter.com/dog_rates/status/830097400375152640/photo/1",https://pbs.twimg.com/media/C4UZLZLWYAA0dcs.jpg,
829861396166877184,This is Mia. She already knows she's a good dog. You don't have to tell her. 12/10 would probably tell her anyway https://t.co/xeudgDXmTU,Mia,2243,13441,Twitter for iPhone,12.0,10.0,1,Border Terrier,https://twitter.com/dog_rates/status/829861396166877184/photo/1,https://pbs.twimg.com/media/C4RCiIHWYAAwgJM.jpg,
829501995190984704,This is Leo. He was a skater pup. She said see ya later pup. He wasn't good enough for her. 12/10 you're good enough for me Leo https://t.co/Xw9JbJHTul,Leo,12224,34913,Twitter for iPhone,12.0,10.0,1,French Bulldog,"https://twitter.com/dog_rates/status/829501995190984704/photo/1,https://twitter.com/dog_rates/status/829501995190984704/photo/1",https://pbs.twimg.com/media/C4L7p19W8AA3Fs_.jpg,
829449946868879360,Here's a stressed doggo. Had a long day. Many things on her mind. The hat communicates these feelings exquisitely. 11/10 https://t.co/fmRS43mWQB,None,2329,11519,Twitter for iPhone,11.0,10.0,1,Labrador Retriever,https://twitter.com/dog_rates/status/829449946868879360/photo/1,https://pbs.twimg.com/media/C4LMUf8WYAkWz4I.jpg,doggo
829374341691346946,This is Astrid. She's a guide doggo in training. 13/10 would follow anywhere https://t.co/xo7FZFIAao,Astrid,10706,38074,Twitter for iPhone,13.0,10.0,1,Staffordshire Bullterrier,"https://twitter.com/dog_rates/status/829374341691346946/photo/1,https://twitter.com/dog_rates/status/829374341691346946/photo/1",https://pbs.twimg.com/media/C4KHj-nWQAA3poV.jpg,doggo
829141528400556032,This is Malcolm. He goes from sneaky tongue slip to flirt wink city in a matter of seconds. 12/10 would hug softly https://t.co/rHwfySggqR,Malcolm,8530,26952,Twitter for iPhone,12.0,10.0,2,Golden Retriever,"https://twitter.com/dog_rates/status/829141528400556032/photo/1,https://twitter.com/dog_rates/status/829141528400556032/photo/1",https://pbs.twimg.com/media/C4GzztSWAAA_qi4.jpg,
829011960981237760,This is Dexter. He was reunited with his mom yesterday after she was stuck in Iran during the travel Bannon. 13/10 welcome home https://t.co/U50RlRw4is,Dexter,18627,58302,Twitter for iPhone,13.0,10.0,2,Boxer,"https://twitter.com/dog_rates/status/829011960981237760/photo/1,https://twitter.com/dog_rates/status/829011960981237760/photo/1",https://pbs.twimg.com/media/C4E99ygWcAAQpPs.jpg,
828770345708580865,This is Alfie. He's your Lyft for tonight. Kindly requests you buckle pup and remain reasonably calm during the ride. 13/10 he must focus https://t.co/AqPTHYUBFz,Alfie,6746,28085,Twitter for iPhone,13.0,10.0,1,,https://twitter.com/dog_rates/status/828770345708580865/photo/1,https://pbs.twimg.com/media/C4BiOXOXAAAf6IS.jpg,
828708714936930305,This is Fiona. She's an exotic dog. Seems rather impatient. Jaw extension on another level tho. Looks slippery. 10/10 would still pet https://t.co/vst2SEVJO3,Fiona,12882,40241,Twitter for iPhone,10.0,10.0,1,,"https://twitter.com/dog_rates/status/828708714936930305/photo/1,https://twitter.com/dog_rates/status/828708714936930305/photo/1",https://pbs.twimg.com/media/C4AqLSgVYAEg8nt.jpg,
828650029636317184,"Occasionally, we're sent fantastic stories. This is one of them. 14/10 for Grace https://t.co/bZ4axuH6OK",None,1544,10467,Twitter for iPhone,14.0,10.0,1,Golden Retriever,"https://twitter.com/dog_rates/status/828650029636317184/photo/1,https://twitter.com/dog_rates/status/828650029636317184/photo/1,https://twitter.com/dog_rates/status/828650029636317184/photo/1",https://pbs.twimg.com/media/C3_0yhCWEAETXj2.jpg,
828409743546925057,This is Mutt Ryan. He's quite confident at the moment. 12/10 rise pup! https://t.co/ZH5CvRlCxt,Mutt,1305,6898,Twitter for iPhone,12.0,10.0,1,,https://twitter.com/dog_rates/status/828409743546925057/photo/1,https://pbs.twimg.com/media/C38aQYgXAAMY2Wh.jpg,
828408677031882754,This is Bear. He went outside to play in the snow. Needed a break from the game. Feeling a tad better now. 12/10  deep breaths Bear https://t.co/7WFLKli2T3,Bear,1477,8398,Twitter for iPhone,12.0,10.0,1,Weimaraner,https://twitter.com/dog_rates/status/828408677031882754/photo/1,https://pbs.twimg.com/media/C38ZSzlWIAEpQzs.jpg,
828381636999917570,Meet Doobert. He's a deaf doggo. Didn't stop him on the field tho. Absolute legend today. 14/10 would pat head approvingly https://t.co/iCk7zstRA9,Doobert,2554,13864,Twitter for iPhone,14.0,10.0,1,Bedlington Terrier,https://twitter.com/dog_rates/status/828381636999917570/photo/1,https://pbs.twimg.com/media/C38Asz1WEAAvzj3.jpg,doggo
828376505180889089,"This is Beebop. Her name means ""Good Dog"" in robot. She also was a star on the field today. 13/10 would pet well https://t.co/HKBVZqXFNR",Beebop,1216,8112,Twitter for iPhone,13.0,10.0,1,American Staffordshire Terrier,https://twitter.com/dog_rates/status/828376505180889089/photo/1,https://pbs.twimg.com/media/C378BwxWMAA6CNK.jpg,
828372645993398273,This is Alexander Hamilpup. He was one of the many stars in this year's Puppy Bowl. He just hopes both teams had fun. 12/10 https://t.co/JcTuUcyYNS,Alexander,3344,13756,Twitter for iPhone,12.0,10.0,1,Malamute,https://twitter.com/dog_rates/status/828372645993398273/photo/1,https://pbs.twimg.com/media/C374hb0WQAAIbQ-.jpg,
828046555563323392,This is Sailer. He waits on the roof for his owners to come home. Nobody knows how he gets up there. H*ckin loyal af. 13/10 https://t.co/O37z4jaMG9,Sailer,3260,12923,Twitter for iPhone,13.0,10.0,3,,"https://twitter.com/dog_rates/status/828046555563323392/photo/1,https://twitter.com/dog_rates/status/828046555563323392/photo/1,https://twitter.com/dog_rates/status/828046555563323392/photo/1",https://pbs.twimg.com/media/C33P8PrUcAMiQQs.jpg,
828011680017821696,Say hello to Brutus and Jersey. They think they're the same size. Best furiends furever. Both 11/10 would pet simultaneously https://t.co/rkhCFfDtxB,Brutus,2451,11411,Twitter for iPhone,11.0,10.0,1,American Staffordshire Terrier,"https://twitter.com/dog_rates/status/828011680017821696/photo/1,https://twitter.com/dog_rates/status/828011680017821696/photo/1",https://pbs.twimg.com/media/C32wOLcWYAAjNqS.jpg,
827933404142436356,This is Kona. Yesterday she stopped by the department to see what it takes to be a police pupper. 12/10 vest was only a smidge too big https://t.co/j8D3PQJvpJ,Kona,5987,22180,Twitter for iPhone,12.0,10.0,2,German Shepherd,"https://twitter.com/dog_rates/status/827933404142436356/photo/1,https://twitter.com/dog_rates/status/827933404142436356/photo/1,https://twitter.com/dog_rates/status/827933404142436356/photo/1",https://pbs.twimg.com/media/C31pCN4UcAAOLNH.jpg,pupper
827653905312006145,This is Boots. She doesn't know what to do with treats so she just holds them. Very good girl. 12/10 would give more treats https://t.co/eAA8lratd3,Boots,3433,16983,Twitter for iPhone,12.0,10.0,1,Collie,https://twitter.com/dog_rates/status/827653905312006145/photo/1,https://pbs.twimg.com/media/C3xq1ZeWEAEuzw3.jpg,
827600520311402496,Meet Tucker. It's his birthday. He's pupset with you because you're too busy playing @GoodDogsGame to celebrate. 13/10 would put down phone https://t.co/vrppizPGdb,Tucker,1082,8143,Twitter for iPhone,13.0,10.0,1,Pembroke,https://twitter.com/dog_rates/status/827600520311402496/photo/1,https://pbs.twimg.com/media/C3w6RYbWQAAEQ25.jpg,
827324948884643840,"This is Ralphie. He's being treated for an overactive funny bone, which is no joke. 12/10 would try to pet with a straight face https://t.co/UU3KqQF5n5",Ralphie,3510,17523,Twitter for iPhone,12.0,10.0,1,Golden Retriever,https://twitter.com/dog_rates/status/827324948884643840/photo/1,https://pbs.twimg.com/media/C3s_pYrXAAA1eqZ.jpg,
827199976799354881,This is Charlie. He wins every game of chess he plays. Won't let opponent pet him until they forfeit. 13/10 you win again Charlie https://t.co/UkyQibIBzZ,Charlie,2579,11659,Twitter for iPhone,13.0,10.0,4,Great Dane,"https://twitter.com/dog_rates/status/827199976799354881/photo/1,https://twitter.com/dog_rates/status/827199976799354881/photo/1,https://twitter.com/dog_rates/status/827199976799354881/photo/1,https://twitter.com/dog_rates/status/827199976799354881/photo/1",https://pbs.twimg.com/media/C3rN-lcWEAA9CmR.jpg,
826958653328592898,This is Loki. He smiles like Elvis. Ain't nothin but a hound doggo. 12/10 https://t.co/QV5nx6otZR,Loki,5757,23767,Twitter for iPhone,12.0,10.0,1,Golden Retriever,https://twitter.com/dog_rates/status/826958653328592898/photo/1,https://pbs.twimg.com/media/C3nygbBWQAAjwcW.jpg,doggo
826848821049180160,This is Cupid. He was found in the trash. Now he's well on his way to prosthetic front legs and a long happy doggo life. 13/10 heroic af https://t.co/WS0Gha8vRh,Cupid,11878,40325,Twitter for iPhone,13.0,10.0,4,Great Pyrenees,"https://twitter.com/dog_rates/status/826848821049180160/photo/1,https://twitter.com/dog_rates/status/826848821049180160/photo/1,https://twitter.com/dog_rates/status/826848821049180160/photo/1,https://twitter.com/dog_rates/status/826848821049180160/photo/1",https://pbs.twimg.com/media/C3mOnZ_XUAAjr2V.jpg,doggo
826598365270007810,This is Pawnd... James Pawnd. He's suave af. 13/10 would trust with my life https://t.co/YprN62Z74I,Pawnd,2709,11117,Twitter for iPhone,13.0,10.0,1,French Bulldog,"https://twitter.com/dog_rates/status/826598365270007810/photo/1,https://twitter.com/dog_rates/status/826598365270007810/photo/1,https://twitter.com/dog_rates/status/826598365270007810/photo/1",https://pbs.twimg.com/media/C3iq0EEXUAAdBYC.jpg,
826476773533745153,This is Pilot. He has mastered the synchronized head tilt and sneaky tongue slip. Usually not unlocked until later doggo days. 12/10 https://t.co/YIV8sw8xkh,Pilot,4821,20275,Twitter for iPhone,12.0,10.0,1,German Shepherd,https://twitter.com/dog_rates/status/826476773533745153/photo/1,https://pbs.twimg.com/media/C3g8M0lWIAEcFgn.jpg,doggo
826240494070030336,We only rate dogs. Please don't send in any more non-dogs like this Wild Albanian Street Moose. Thank you... 11/10 https://t.co/srXL2s868C,None,2965,14614,Twitter for iPhone,11.0,10.0,1,French Bulldog,https://twitter.com/dog_rates/status/826240494070030336/photo/1,https://pbs.twimg.com/media/C3dlVMbXAAUd-Gh.jpg,
826204788643753985,"Here's a little more info on Dew, your favorite roaming doggo that went h*ckin viral. 13/10 
https://t.co/1httNYrCeW https://t.co/KvaM8j3jhX",None,1075,5361,Twitter for iPhone,13.0,10.0,2,Labrador Retriever,"http://us.blastingnews.com/news/2017/01/kentucky-teen-helps-lost-yellow-labrador-and-gets-a-huge-surprise-001431969.html?sbdht=_pM1QUzk3wsenGU1giO7UnJ5NGGiKRW9AD5xs2MkaDpYY13JxbtKE4w2_,https://twitter.com/dog_rates/status/826204788643753985/photo/1,https://twitter.com/dog_rates/status/826204788643753985/photo/1,https://twitter.com/dog_rates/status/826204788643753985/photo/1,https://twitter.com/dog_rates/status/826204788643753985/photo/1",https://pbs.twimg.com/media/C3dEza1WcAAhlNU.jpg,doggo
826115272272650244,This is Ike. He's demonstrating the pupmost restraint. 13/10 super good boy https://t.co/6gHoGah9nm,Ike,3599,17299,Twitter for iPhone,13.0,10.0,1,,https://twitter.com/dog_rates/status/826115272272650244/photo/1,https://pbs.twimg.com/media/C3bzVILWcAUjS5i.jpg,
825876512159186944,This is Mo. No one will push him around in the grocery cart. He's quite pupset about it. 11/10 I volunteer https://t.co/feNwTq12S5,Mo,2146,11525,Twitter for iPhone,11.0,10.0,1,,https://twitter.com/dog_rates/status/825876512159186944/photo/1,https://pbs.twimg.com/media/C3YaSnQWAAILgz0.jpg,
825829644528148480,This is Toby. He just found out you only pretend to throw the ball sometimes. H*ckin puppalled. 12/10 would console https://t.co/YimNdkZrhM,Toby,2848,14025,Twitter for iPhone,12.0,10.0,2,Great Pyrenees,"https://twitter.com/dog_rates/status/825829644528148480/photo/1,https://twitter.com/dog_rates/status/825829644528148480/photo/1",https://pbs.twimg.com/media/C3XvqILXUAU2nnT.jpg,
825535076884762624,Here's a very loving and accepting puppo. Appears to have read her Constitution well. 14/10 would pat head approvingly https://t.co/6ao80wIpV1,None,19669,56413,Twitter for iPhone,14.0,10.0,1,Rottweiler,https://twitter.com/dog_rates/status/825535076884762624/photo/1,https://pbs.twimg.com/media/C3TjvitXAAAI-QH.jpg,puppo
825147591692263424,This is Sweet Pea. She hides in shoe boxes and waits for someone to pick her. Then she surpuprises them. 13/10 https://t.co/AyBEmx56MD,Sweet,5244,20181,Twitter for iPhone,13.0,10.0,1,Pekinese,https://twitter.com/dog_rates/status/825147591692263424/photo/1,https://pbs.twimg.com/media/C3ODWpfXAAAP1fb.jpg,
825026590719483904,"Say hello to Pablo. He's one gorgeous puppo. A true 12/10. Click the link to see why Pablo requests your assistance

https://t.co/koHvVQp9bL https://t.co/IhW0JKf7kc",Pablo,1483,7020,Twitter for iPhone,12.0,10.0,2,Eskimo Dog,"https://www.gofundme.com/my-puppys-double-cataract-surgery,https://twitter.com/dog_rates/status/825026590719483904/photo/1,https://twitter.com/dog_rates/status/825026590719483904/photo/1",https://pbs.twimg.com/media/C3MVTeHWcAAGNfx.jpg,puppo
824775126675836928,This is Scooter. His lack of opposable thumbs is rendering his resistance to tickling embarrassingly moot. 12/10 would keep tickling https://t.co/F0VWg2GztI,Scooter,4069,16508,Twitter for iPhone,12.0,10.0,1,Border Terrier,"https://twitter.com/dog_rates/status/824775126675836928/photo/1,https://twitter.com/dog_rates/status/824775126675836928/photo/1",https://pbs.twimg.com/media/C3Iwlr0WYAARVh4.jpg,
824663926340194305,This is Wilson. Named after the volleyball. He tongue wrestled a bee and lost. 13/10 valiant effort tho https://t.co/A5Mx4h1FSM,Wilson,1993,11113,Twitter for iPhone,13.0,10.0,1,English Setter,https://twitter.com/dog_rates/status/824663926340194305/photo/1,https://pbs.twimg.com/media/C3HLd0HXUAAUI2b.jpg,
824325613288833024,Retweet the h*ck out of this 13/10 pupper #BellLetsTalk https://t.co/wBmc7OaGvS,None,11848,12999,Twitter for iPhone,13.0,10.0,1,Pembroke,https://twitter.com/dog_rates/status/824325613288833024/photo/1,https://pbs.twimg.com/media/C3CXxaoWQAAiLuC.jpg,pupper
824297048279236611,This is Nala. She got in trouble. One h*ck of a pupnishment. Still 11/10 would pet https://t.co/EmJbG0skLt,Nala,4463,16625,Twitter for iPhone,11.0,10.0,2,,"https://twitter.com/dog_rates/status/824297048279236611/photo/1,https://twitter.com/dog_rates/status/824297048279236611/photo/1",https://pbs.twimg.com/media/C3B9ypNWEAM1bVs.jpg,
823939628516474880,This is Cash. He's officially given pup on today. 12/10 frighteningly relatable https://t.co/m0hrATIEyw,Cash,3123,11755,Twitter for iPhone,12.0,10.0,1,Schipperke,https://twitter.com/dog_rates/status/823939628516474880/photo/1,https://pbs.twimg.com/media/C284uD8WgAEmMVn.jpg,
823699002998870016,This is Winston. The goggles make him a superhero. Protects the entire city from criminals unless they rub his belly really well. 12/10 https://t.co/yCydYURYEL,Winston,2772,13826,Twitter for iPhone,12.0,10.0,1,Cairn,https://twitter.com/dog_rates/status/823699002998870016/photo/1,https://pbs.twimg.com/media/C25d3nkXEAAFBUN.jpg,
823581115634085888,This is Crawford. He's quite h*ckin good at the selfies. Nose is incredibly boopable. 11/10 would snapchat https://t.co/6F5Rrp472U,Crawford,3031,14376,Twitter for iPhone,11.0,10.0,1,,https://twitter.com/dog_rates/status/823581115634085888/photo/1,https://pbs.twimg.com/media/C23ypm6VQAAO31l.jpg,
823322678127919110,This is Wyatt. He's got the fastest paws in the West. H*ckin deadly. 11/10 would ride into the sunset with https://t.co/stkJ377KK7,Wyatt,4637,17437,Twitter for iPhone,11.0,10.0,2,,"https://twitter.com/dog_rates/status/823322678127919110/photo/1,https://twitter.com/dog_rates/status/823322678127919110/photo/1",https://pbs.twimg.com/media/C20HmaKWgAQ6-6X.jpg,
822975315408461824,This is Albus. He's soaked as h*ck. Seems to have misplaced an ear as well. Still in good spirits tho. 12/10 would dry https://t.co/yUM8jYStuG,Albus,3958,19139,Twitter for iPhone,12.0,10.0,1,,https://twitter.com/dog_rates/status/822975315408461824/photo/1,https://pbs.twimg.com/media/C2vLrpvWIAA3LM3.jpg,
822872901745569793,Here's a super supportive puppo participating in the Toronto  #WomensMarch today. 13/10 https://t.co/nTz3FtorBc,None,48265,132810,Twitter for iPhone,13.0,10.0,1,Lakeland Terrier,https://twitter.com/dog_rates/status/822872901745569793/photo/1,https://pbs.twimg.com/media/C2tugXLXgAArJO4.jpg,puppo
822859134160621569,This is Hobbes. He was told he was going to the park. Ended up at the vet. H*ckin bamboozled. Quite pupset with you. 12/10 https://t.co/SSQE06XClS,Hobbes,2622,14576,Twitter for iPhone,12.0,10.0,1,Malinois,https://twitter.com/dog_rates/status/822859134160621569/photo/1,https://pbs.twimg.com/media/C2tiAzGXgAIFdqi.jpg,
822610361945911296,Please stop sending in non-canines like this Very Pettable Dozing Bath Tortoise. We only rate dogs. Only send dogs... 12/10 https://t.co/mcagPeENIh,None,3423,16327,Twitter for iPhone,12.0,10.0,1,Cocker Spaniel,https://twitter.com/dog_rates/status/822610361945911296/photo/1,https://pbs.twimg.com/media/C2p_wQyXEAELtvS.jpg,
822489057087389700,This is Paisley. She really wanted to be president this time. Dreams officially crushed. 13/10 https://t.co/liJGwMp17E,Paisley,7390,20083,Twitter for iPhone,13.0,10.0,1,Samoyed,"https://twitter.com/dog_rates/status/822489057087389700/photo/1,https://twitter.com/dog_rates/status/822489057087389700/photo/1,https://twitter.com/dog_rates/status/822489057087389700/photo/1",https://pbs.twimg.com/media/C2oRbOuWEAAbVSl.jpg,
822462944365645825,"This is Gabe. He was the unequivocal embodiment of a dream meme, but also one h*ck of a pupper. You will be missed by so many. 14/10 RIP https://t.co/M3hZGadUuO",Gabe,17209,31800,Twitter for iPhone,14.0,10.0,3,Pomeranian,"https://twitter.com/dog_rates/status/822462944365645825/photo/1,https://twitter.com/dog_rates/status/822462944365645825/photo/1,https://twitter.com/dog_rates/status/822462944365645825/photo/1,https://twitter.com/dog_rates/status/822462944365645825/photo/1",https://pbs.twimg.com/media/C2n5rUUXEAIXAtv.jpg,pupper
822244816520155136,We only rate dogs. Please don't send pics of men capturing low level clouds. Thank you... 11/10 https://t.co/rLi83ZyCL5,None,11421,38832,Twitter for iPhone,11.0,10.0,1,Samoyed,https://twitter.com/dog_rates/status/822244816520155136/photo/1,https://pbs.twimg.com/media/C2kzTGxWEAEOpPL.jpg,
821886076407029760,This is Jimison. He was just called a good boy. 13/10 https://t.co/djMep7mGkV,Jimison,2692,12582,Twitter for iPhone,13.0,10.0,1,Golden Retriever,https://twitter.com/dog_rates/status/821886076407029760/photo/1,https://pbs.twimg.com/media/C2ftAxnWIAEUdAR.jpg,
821765923262631936,This is Duchess. She uses dark doggo forces to levitate her toys. 13/10 magical af https://t.co/maDNMETA52,Duchess,1899,9317,Twitter for iPhone,13.0,10.0,1,Golden Retriever,https://twitter.com/dog_rates/status/821765923262631936/photo/1,https://pbs.twimg.com/media/C2d_vnHWEAE9phX.jpg,doggo
821522889702862852,This is Harlso. He has a really good idea but isn't sure you're going to like it. 13/10 he'll just keep it to himself https://t.co/IzcaR3Nqyn,Harlso,2030,8871,Twitter for iPhone,13.0,10.0,1,Doberman,https://twitter.com/dog_rates/status/821522889702862852/photo/1,https://pbs.twimg.com/media/C2aitIUXAAAG-Wi.jpg,
821407182352777218,This is Sundance. He's a doggo drummer. Even sings a bit on the side. 14/10 entertained af (vid by @sweetsundance) https://t.co/Xn5AQtiqzG,Sundance,5053,13075,Twitter for iPhone,14.0,10.0,1,Irish Setter,https://twitter.com/dog_rates/status/821407182352777218/video/1,https://pbs.twimg.com/ext_tw_video_thumb/821407155391725568/pu/img/AJC07gFJDDBuwNTD.jpg,doggo
821149554670182400,This is Luca. He got caught howling. H*ckin embarrassed. 12/10 https://t.co/r8DxA8DYJ2,Luca,2320,9718,Twitter for iPhone,12.0,10.0,1,German Shepherd,https://twitter.com/dog_rates/status/821149554670182400/video/1,https://pbs.twimg.com/ext_tw_video_thumb/821149477142556673/pu/img/88_DV098c60pC5AA.jpg,
821107785811234820,Here's a doggo who looks like he's about to give you a list of mythical ingredients to go collect for his potion. 11/10 would obey https://t.co/8SiwKDlRcl,None,2487,10645,Twitter for iPhone,11.0,10.0,1,Pomeranian,https://twitter.com/dog_rates/status/821107785811234820/photo/1,https://pbs.twimg.com/media/C2UpLA-UcAEK_Fz.jpg,doggo
821044531881721856,This is Flash. He went way too hard celebrating Martin Luther King Day last night. 12/10 now he's having a dream in his honor https://t.co/bryVdNaRcu,Flash,2636,14021,Twitter for iPhone,12.0,10.0,1,Old English Sheepdog,https://twitter.com/dog_rates/status/821044531881721856/photo/1,https://pbs.twimg.com/media/C2Tvo20XcAAhNL9.jpg,
820749716845686786,Meet Sunny. He can take down a polar bear in one fell swoop. Fr*cken deadly af. 13/10 would pet with caution https://t.co/EMq8Ud6Ze1,Sunny,11525,34984,Twitter for iPhone,13.0,10.0,2,Golden Retriever,"https://twitter.com/dog_rates/status/820749716845686786/photo/1,https://twitter.com/dog_rates/status/820749716845686786/photo/1",https://pbs.twimg.com/media/C2PjgjQXcAAc4Uu.jpg,
820690176645140481,The floofs have been released I repeat the floofs have been released. 84/70 https://t.co/NIYC820tmd,None,3716,13518,Twitter for iPhone,12.0,10.0,2,West Highland White Terrier,"https://twitter.com/dog_rates/status/820690176645140481/photo/1,https://twitter.com/dog_rates/status/820690176645140481/photo/1,https://twitter.com/dog_rates/status/820690176645140481/photo/1",https://pbs.twimg.com/media/C2OtWr0VQAEnS9r.jpg,
820314633777061888,"We are proud to support @LoveYourMelon on their mission to put a hat on every kid battling cancer. They are 14/10

https://t.co/XQlmPTLHPl https://t.co/ZNIkkHgtYE",None,648,3706,Twitter for iPhone,14.0,10.0,2,Gordon Setter,"https://www.loveyourmelon.com/pages/ourstory,https://twitter.com/dog_rates/status/820314633777061888/photo/1,https://twitter.com/dog_rates/status/820314633777061888/photo/1,https://twitter.com/dog_rates/status/820314633777061888/photo/1",https://pbs.twimg.com/media/C2JXyARUAAE4gbL.jpg,
820078625395449857,I've never wanted to go to a camp more in my entire life. 12/10 for all on board https://t.co/wJZlpGFEbD,None,7246,21979,Twitter for iPhone,12.0,10.0,3,,"https://twitter.com/dog_rates/status/820078625395449857/photo/1,https://twitter.com/dog_rates/status/820078625395449857/photo/1,https://twitter.com/dog_rates/status/820078625395449857/photo/1",https://pbs.twimg.com/media/C2GBJADWIAQvcNb.jpg,
819952236453363712,"This is Oliver. He has dreams of being a service puppo so he can help his owner. 13/10 selfless af

make it happen:
https://t.co/f5WMsx0a9K https://t.co/6lJz0DKZIb",Oliver,1369,5927,Twitter for iPhone,13.0,10.0,1,American Staffordshire Terrier,"https://www.gofundme.com/servicedogoliver,https://twitter.com/dog_rates/status/819952236453363712/photo/1",https://pbs.twimg.com/media/C2EONHNWQAUWxkP.jpg,puppo
819924195358416896,Here we have a doggo who has messed up. He was hoping you wouldn't notice. 11/10 someone help him https://t.co/XdRNXNYD4E,None,5607,14305,Twitter for iPhone,11.0,10.0,1,,https://twitter.com/dog_rates/status/819924195358416896/video/1,https://pbs.twimg.com/ext_tw_video_thumb/819924138965999617/pu/img/6OIToyT9eLESHXLU.jpg,doggo
819711362133872643,This is Howie. He just bloomed. 11/10 revolutionary af https://t.co/m5fYxrO3IU,Howie,3604,14916,Twitter for iPhone,11.0,10.0,2,,"https://twitter.com/dog_rates/status/819711362133872643/photo/1,https://twitter.com/dog_rates/status/819711362133872643/photo/1",https://pbs.twimg.com/media/C2AzHjQWQAApuhf.jpg,
819588359383371776,This is Jazzy. She just found out that sandwich wasn't for her. Shocked and puppalled. 13/10 deep breaths Jazzy https://t.co/52cItP0vIO,Jazzy,2271,10606,Twitter for iPhone,13.0,10.0,1,Cardigan,https://twitter.com/dog_rates/status/819588359383371776/photo/1,https://pbs.twimg.com/media/C1_DQn3UoAIoJy7.jpg,
819347104292290561,Say hello to Anna and Elsa. They fall asleep in similar positions. It's pretty wild. Both 12/10 would snug simultaneously https://t.co/8rUL99bX4W,Anna,1383,8008,Twitter for iPhone,12.0,10.0,3,Rottweiler,"https://twitter.com/dog_rates/status/819347104292290561/photo/1,https://twitter.com/dog_rates/status/819347104292290561/photo/1,https://twitter.com/dog_rates/status/819347104292290561/photo/1",https://pbs.twimg.com/media/C17n1nrWQAIErU3.jpg,
819227688460238848,This is Finn. He's wondering if you come here often. Fr*ckin flirtatious af. 12/10 would give number to https://t.co/ii5eNX5LJT,Finn,7733,25652,Twitter for iPhone,12.0,10.0,1,Border Terrier,https://twitter.com/dog_rates/status/819227688460238848/photo/1,https://pbs.twimg.com/media/C157Oq3WQAEOyHm.jpg,
819006400881917954,This is Sunny. She was also a very good First Doggo. 14/10 would also be an absolute honor to pet https://t.co/YOC1fHFCSb,Sunny,21794,49960,Twitter for iPhone,14.0,10.0,4,,"https://twitter.com/dog_rates/status/819006400881917954/photo/1,https://twitter.com/dog_rates/status/819006400881917954/photo/1,https://twitter.com/dog_rates/status/819006400881917954/photo/1,https://twitter.com/dog_rates/status/819006400881917954/photo/1",https://pbs.twimg.com/media/C12x-JTVIAAzdfl.jpg,doggo
