tweet_id,full_text,name,retweet_count,favorite_count,source,normalized_numerator,normalized_denominator,img_num,breed,expanded_urls,jpg_url,dog_stage
892420643555336193,This is Phineas. He's a mystical boy. Only ever appears in the hole of a donut. 13/10 https://t.co/MgUWQ76dJU,Phineas,8853,39467,Twitter for iPhone,13.0,10.0,1,,https://twitter.com/dog_rates/status/892420643555336193/photo/1,https://pbs.twimg.com/media/DGKD1-bXoAAIAUK.jpg,
892177421306343426,"This is Tilly. She's just checking pup on you. Hopes you're doing ok. If not, she's available for pats, snugs, boops, the whole bit. 13/10 https://t.co/0Xxu71qeIV",Tilly,6514,33819,Twitter for iPhone,13.0,10.0,1,Chihuahua,https://twitter.com/dog_rates/status/892177421306343426/photo/1,https://pbs.twimg.com/media/DGGmoV4XsAAUL6n.jpg,
891815181378084864,This is Archie. He is a rare Norwegian Pouncing Corgo. Lives in the tall grass. You never know when one may strike. 12/10 https://t.co/wUnZnhtVJB,Archie,4328,25461,Twitter for iPhone,12.0,10.0,1,Chihuahua,https://twitter.com/dog_rates/status/891815181378084864/photo/1,https://pbs.twimg.com/media/DGBdLU1WsAANxJ9.jpg,
891689557279858688,This is Darla. She commenced a snooze mid meal. 13/10 happens to the best of us https://t.co/tD36da7qLQ,Darla,8964,42908,Twitter for iPhone,13.0,10.0,1,,https://twitter.com/dog_rates/status/891689557279858688/photo/1,https://pbs.twimg.com/media/DF_q7IAWsAEuuN8.jpg,
891327558926688256,"This is Franklin. He would like you to stop calling him ""cute."" He is a very fierce shark and should be respected as such. 12/10 #BarkWeek https://t.co/AtUZn91f7f",Franklin,9774,41048,Twitter for iPhone,12.0,10.0,2,Basset,"https://twitter.com/dog_rates/status/891327558926688256/photo/1,https://twitter.com/dog_rates/status/891327558926688256/photo/1",https://pbs.twimg.com/media/DF6hr6BUMAAzZgT.jpg,
891087950875897856,Here we have a majestic great white breaching off South Africa's coast. Absolutely h*ckin breathtaking. 13/10 (IG: tucker_marlo) #BarkWeek https://t.co/kQ04fDDRmh,None,3261,20562,Twitter for iPhone,13.0,10.0,1,Chesapeake Bay Retriever,https://twitter.com/dog_rates/status/891087950875897856/photo/1,https://pbs.twimg.com/media/DF3HwyEWsAABqE6.jpg,
890971913173991426,"Meet Jax. He enjoys ice cream so much he gets nervous around it. 13/10 help Jax enjoy more things by clicking below

https://t.co/Zr4hWfAs1H https://t.co/tVJBRMnhxl",Jax,2158,12041,Twitter for iPhone,13.0,10.0,1,Appenzeller,"https://gofundme.com/ydvmve-surgery-for-jax,https://twitter.com/dog_rates/status/890971913173991426/photo/1",https://pbs.twimg.com/media/DF1eOmZXUAALUcq.jpg,
890729181411237888,When you watch your owner call another dog a good boy but then they turn back to you and say you're a great boy. 13/10 https://t.co/v0nONBcwxq,None,16716,56848,Twitter for iPhone,13.0,10.0,2,Pomeranian,"https://twitter.com/dog_rates/status/890729181411237888/photo/1,https://twitter.com/dog_rates/status/890729181411237888/photo/1",https://pbs.twimg.com/media/DFyBahAVwAAhUTd.jpg,
890609185150312448,This is Zoey. She doesn't want to be one of the scary sharks. Just wants to be a snuggly pettable boatpet. 13/10 #BarkWeek https://t.co/9TwLuAGH0b,Zoey,4429,28226,Twitter for iPhone,13.0,10.0,1,Irish Terrier,https://twitter.com/dog_rates/status/890609185150312448/photo/1,https://pbs.twimg.com/media/DFwUU__XcAEpyXI.jpg,
890240255349198849,This is Cassie. She is a college pup. Studying international doggo communication and stick theory. 14/10 so elegant much sophisticate https://t.co/t1bfwz5S2A,Cassie,7711,32467,Twitter for iPhone,14.0,10.0,1,Pembroke,https://twitter.com/dog_rates/status/890240255349198849/photo/1,https://pbs.twimg.com/media/DFrEyVuW0AAO3t9.jpg,doggo
890006608113172480,This is Koda. He is a South Australian deckshark. Deceptively deadly. Frighteningly majestic. 13/10 would risk a petting #BarkWeek https://t.co/dVPW0B0Mme,Koda,7624,31166,Twitter for iPhone,13.0,10.0,1,Samoyed,"https://twitter.com/dog_rates/status/890006608113172480/photo/1,https://twitter.com/dog_rates/status/890006608113172480/photo/1",https://pbs.twimg.com/media/DFnwSY4WAAAMliS.jpg,
889880896479866881,This is Bruno. He is a service shark. Only gets out of the water to assist you. 13/10 terrifyingly good boy https://t.co/u1XPQMl29g,Bruno,5156,28268,Twitter for iPhone,13.0,10.0,1,French Bulldog,https://twitter.com/dog_rates/status/889880896479866881/photo/1,https://pbs.twimg.com/media/DFl99B1WsAITKsg.jpg,
889665388333682689,Here's a puppo that seems to be on the fence about something haha no but seriously someone help her. 13/10 https://t.co/BxvuXk0UCm,None,8538,38818,Twitter for iPhone,13.0,10.0,1,Pembroke,https://twitter.com/dog_rates/status/889665388333682689/photo/1,https://pbs.twimg.com/media/DFi579UWsAAatzw.jpg,puppo
889638837579907072,This is Ted. He does his best. Sometimes that's not enough. But it's ok. 12/10 would assist https://t.co/f8dEDcrKSR,Ted,4735,27672,Twitter for iPhone,12.0,10.0,1,French Bulldog,"https://twitter.com/dog_rates/status/889638837579907072/photo/1,https://twitter.com/dog_rates/status/889638837579907072/photo/1",https://pbs.twimg.com/media/DFihzFfXsAYGDPR.jpg,
889531135344209921,This is Stuart. He's sporting his favorite fanny pack. Secretly filled with bones only. 13/10 puppared puppo #BarkWeek https://t.co/y70o6h3isq,Stuart,2321,15359,Twitter for iPhone,13.0,10.0,1,Golden Retriever,https://twitter.com/dog_rates/status/889531135344209921/photo/1,https://pbs.twimg.com/media/DFg_2PVW0AEHN3p.jpg,puppo
889278841981685760,This is Oliver. You're witnessing one of his many brutal attacks. Seems to be playing with his victim. 13/10 fr*ckin frightening #BarkWeek https://t.co/WpHvrQedPb,Oliver,5637,25652,Twitter for iPhone,13.0,10.0,1,Whippet,https://twitter.com/dog_rates/status/889278841981685760/video/1,https://pbs.twimg.com/ext_tw_video_thumb/889278779352338437/pu/img/VlbFB3v8H8VwzVNY.jpg,
888917238123831296,This is Jim. He found a fren. Taught him how to sit like the good boys. 12/10 for both https://t.co/chxruIOUJN,Jim,4709,29611,Twitter for iPhone,12.0,10.0,1,Golden Retriever,https://twitter.com/dog_rates/status/888917238123831296/photo/1,https://pbs.twimg.com/media/DFYRgsOUQAARGhO.jpg,
888804989199671297,This is Zeke. He has a new stick. Very proud of it. Would like you to throw it for him without taking it. 13/10 would do my best https://t.co/HTQ77yNQ5K,Zeke,4559,26080,Twitter for iPhone,13.0,10.0,1,Golden Retriever,"https://twitter.com/dog_rates/status/888804989199671297/photo/1,https://twitter.com/dog_rates/status/888804989199671297/photo/1",https://pbs.twimg.com/media/DFWra-3VYAA2piG.jpg,
888554962724278272,This is Ralphus. He's powering up. Attempting maximum borkdrive. 13/10 inspirational af https://t.co/YnYAFCTTiK,Ralphus,3732,20290,Twitter for iPhone,13.0,10.0,3,Siberian Husky,"https://twitter.com/dog_rates/status/888554962724278272/photo/1,https://twitter.com/dog_rates/status/888554962724278272/photo/1,https://twitter.com/dog_rates/status/888554962724278272/photo/1,https://twitter.com/dog_rates/status/888554962724278272/photo/1",https://pbs.twimg.com/media/DFTH_O-UQAACu20.jpg,
888078434458587136,This is Gerald. He was just told he didn't get the job he interviewed for. A h*ckin injustice. 12/10 didn't want the job anyway https://t.co/DK7iDPfuRX,Gerald,3653,22201,Twitter for iPhone,12.0,10.0,1,French Bulldog,"https://twitter.com/dog_rates/status/888078434458587136/photo/1,https://twitter.com/dog_rates/status/888078434458587136/photo/1",https://pbs.twimg.com/media/DFMWn56WsAAkA7B.jpg,
887705289381826560,This is Jeffrey. He has a monopoly on the pool noodles. Currently running a 'boop for two' midweek sale. 13/10 h*ckin strategic https://t.co/PhrUk20Q64,Jeffrey,5609,30779,Twitter for iPhone,13.0,10.0,1,Basset,https://twitter.com/dog_rates/status/887705289381826560/photo/1,https://pbs.twimg.com/media/DFHDQBbXgAEqY7t.jpg,
887517139158093824,I've yet to rate a Venezuelan Hover Wiener. This is such an honor. 14/10 paw-inspiring af (IG: roxy.thedoxy) https://t.co/20VrLAA8ba,None,12082,46959,Twitter for iPhone,14.0,10.0,1,,https://twitter.com/dog_rates/status/887517139158093824/video/1,https://pbs.twimg.com/ext_tw_video_thumb/887517108413886465/pu/img/WanJKwssZj4VJvL9.jpg,
887473957103951883,This is Canela. She attempted some fancy porch pics. They were unsuccessful. 13/10 someone help her https://t.co/cLyzpcUcMX,Canela,18781,69871,Twitter for iPhone,13.0,10.0,2,Pembroke,"https://twitter.com/dog_rates/status/887473957103951883/photo/1,https://twitter.com/dog_rates/status/887473957103951883/photo/1",https://pbs.twimg.com/media/DFDw2tyUQAAAFke.jpg,
887343217045368832,You may not have known you needed to see this today. 13/10 please enjoy (IG: emmylouroo) https://t.co/WZqNqygEyV,None,10737,34222,Twitter for iPhone,13.0,10.0,1,Mexican Hairless,https://twitter.com/dog_rates/status/887343217045368832/video/1,https://pbs.twimg.com/ext_tw_video_thumb/887343120832229379/pu/img/6HSuFrW1lzI_9Mht.jpg,
887101392804085760,This... is a Jubilant Antarctic House Bear. We only rate dogs. Please only send dogs. Thank you... 12/10 would suffocate in floof https://t.co/4Ad1jzJSdp,None,6167,31061,Twitter for iPhone,12.0,10.0,1,Samoyed,https://twitter.com/dog_rates/status/887101392804085760/photo/1,https://pbs.twimg.com/media/DE-eAq6UwAA-jaE.jpg,
886983233522544640,This is Maya. She's very shy. Rarely leaves her cup. 13/10 would find her an environment to thrive in https://t.co/I6oNy0CgiT,Maya,8084,35859,Twitter for iPhone,13.0,10.0,2,Chihuahua,"https://twitter.com/dog_rates/status/886983233522544640/photo/1,https://twitter.com/dog_rates/status/886983233522544640/photo/1",https://pbs.twimg.com/media/DE8yicJW0AAAvBJ.jpg,
886736880519319552,"This is Mingus. He's a wonderful father to his smol pup. Confirmed 13/10, but he needs your help

https://t.co/bVi0Yr4Cff https://t.co/ISvKOSkd5b",Mingus,3443,12306,Twitter for iPhone,13.0,10.0,1,Kuvasz,"https://www.gofundme.com/mingusneedsus,https://twitter.com/dog_rates/status/886736880519319552/photo/1,https://twitter.com/dog_rates/status/886736880519319552/photo/1",https://pbs.twimg.com/media/DE5Se8FXcAAJFx4.jpg,
886680336477933568,This is Derek. He's late for a dog meeting. 13/10 pet...al to the metal https://t.co/BCoWue0abA,Derek,4610,22798,Twitter for iPhone,13.0,10.0,1,,https://twitter.com/dog_rates/status/886680336477933568/photo/1,https://pbs.twimg.com/media/DE4fEDzWAAAyHMM.jpg,
886366144734445568,This is Roscoe. Another pupper fallen victim to spontaneous tongue ejections. Get the BlepiPen immediate. 12/10 deep breaths Roscoe https://t.co/RGE08MIJox,Roscoe,3316,21524,Twitter for iPhone,12.0,10.0,1,French Bulldog,"https://twitter.com/dog_rates/status/886366144734445568/photo/1,https://twitter.com/dog_rates/status/886366144734445568/photo/1",https://pbs.twimg.com/media/DE0BTnQUwAApKEH.jpg,pupper
886258384151887873,This is Waffles. His doggles are pupside down. Unsure how to fix. 13/10 someone assist Waffles https://t.co/xZDA9Qsq1O,Waffles,6523,28469,Twitter for iPhone,13.0,10.0,1,Pug,https://twitter.com/dog_rates/status/886258384151887873/photo/1,https://pbs.twimg.com/media/DEyfTG4UMAE4aE9.jpg,
885984800019947520,Viewer discretion advised. This is Jimbo. He will rip ur finger right h*ckin off. Other dog clearly an accessory. 12/10 pls pet with caution https://t.co/BuveP0uMF1,Jimbo,7097,33382,Twitter for iPhone,12.0,10.0,1,Blenheim Spaniel,https://twitter.com/dog_rates/status/885984800019947520/photo/1,https://pbs.twimg.com/media/DEumeWWV0AA-Z61.jpg,
885528943205470208,This is Maisey. She fell asleep mid-excavation. Happens to the best of us. 13/10 would pat noggin approvingly https://t.co/tp1kQ8i9JF,Maisey,6683,36689,Twitter for iPhone,13.0,10.0,1,Pug,https://twitter.com/dog_rates/status/885528943205470208/photo/1,https://pbs.twimg.com/media/DEoH3yvXgAAzQtS.jpg,
885167619883638784,Here we have a corgi undercover as a malamute. Pawbably doing important investigative work. Zero control over tongue happenings. 13/10 https://t.co/44ItaMubBf,None,4556,22367,Twitter for iPhone,13.0,10.0,4,Malamute,"https://twitter.com/dog_rates/status/885167619883638784/photo/1,https://twitter.com/dog_rates/status/885167619883638784/photo/1,https://twitter.com/dog_rates/status/885167619883638784/photo/1,https://twitter.com/dog_rates/status/885167619883638784/photo/1",https://pbs.twimg.com/media/DEi_N9qXYAAgEEw.jpg,
884925521741709313,"This is Earl. He found a hat. Nervous about what you think of it. 12/10 it's delightful, Earl https://t.co/MYJvdlNRVa",Earl,16439,68152,Twitter for iPhone,12.0,10.0,1,Italian Greyhound,https://twitter.com/dog_rates/status/884925521741709313/photo/1,https://pbs.twimg.com/media/DEfjEaNXkAAtPlj.jpg,
884876753390489601,This is Lola. It's her first time outside. Must test the earth and taste the atmosphere. 13/10 you're doing great Lola https://t.co/74TKAUsLkO,Lola,6096,28514,Twitter for iPhone,13.0,10.0,1,Chow,"https://twitter.com/dog_rates/status/884876753390489601/photo/1,https://twitter.com/dog_rates/status/884876753390489601/photo/1,https://twitter.com/dog_rates/status/884876753390489601/photo/1,https://twitter.com/dog_rates/status/884876753390489601/photo/1",https://pbs.twimg.com/media/DEe2tZXXkAAwyX3.jpg,
884562892145688576,This is Kevin. He's just so happy. 13/10 what is your secret Kevin https://t.co/1r4MFCbCX5,Kevin,5100,24765,Twitter for iPhone,13.0,10.0,1,Pug,https://twitter.com/dog_rates/status/884562892145688576/photo/1,https://pbs.twimg.com/media/DEaZQkfXUAEC7qB.jpg,
884441805382717440,"I present to you, Pup in Hat. Pup in Hat is great for all occasions. Extremely versatile. Compact as h*ck. 14/10 (IG: itselizabethgales) https://t.co/vvBOcC2VdC",None,5856,27478,Twitter for iPhone,14.0,10.0,1,Pembroke,https://twitter.com/dog_rates/status/884441805382717440/photo/1,https://pbs.twimg.com/media/DEYrIZwWsAA2Wo5.jpg,
884162670584377345,Meet Yogi. He doesn't have any important dog meetings today he just enjoys looking his best at all times. 12/10 for dangerously dapper doggo https://t.co/YSI00BzTBZ,Yogi,3128,20771,Twitter for iPhone,12.0,10.0,1,German Shepherd,https://twitter.com/dog_rates/status/884162670584377345/photo/1,https://pbs.twimg.com/media/DEUtQbzW0AUTv_o.jpg,doggo
883838122936631299,This is Noah. He can't believe someone made this mess. Got the vacuum out for you though. Offered to help clean pup. 12/10 super good boy https://t.co/V85xujjDDY,Noah,3586,22349,Twitter for iPhone,12.0,10.0,1,Doberman,https://twitter.com/dog_rates/status/883838122936631299/photo/1,https://pbs.twimg.com/media/DEQGFgAXUAAEvfi.jpg,
883482846933004288,"This is Bella. She hopes her smile made you smile. If not, she is also offering you her favorite monkey. 13.5/10 https://t.co/qjrljjt948",Bella,10407,46860,Twitter for iPhone,5.0,10.0,1,Golden Retriever,"https://twitter.com/dog_rates/status/883482846933004288/photo/1,https://twitter.com/dog_rates/status/883482846933004288/photo/1",https://pbs.twimg.com/media/DELC9dZXUAADqUk.jpg,
883360690899218434,Meet Grizzwald. He may be the floofiest floofer I ever did see. Lost eyes saving a schoolbus from a volcano erpuption. 13/10 heroic as h*ck https://t.co/rf661IFEYP,Grizzwald,3825,22986,Twitter for iPhone,13.0,10.0,1,Chow,https://twitter.com/dog_rates/status/883360690899218434/photo/1,https://pbs.twimg.com/media/DEJT3FeXoAAtwUy.jpg,floofer
883117836046086144,"Please only send dogs. We don't rate mechanics, no matter how h*ckin good. Thank you... 13/10 would sneak a pat https://t.co/Se5fZ9wp5E",None,6949,37914,Twitter for iPhone,13.0,10.0,2,Golden Retriever,"https://twitter.com/dog_rates/status/883117836046086144/photo/1,https://twitter.com/dog_rates/status/883117836046086144/photo/1",https://pbs.twimg.com/media/DEF2-_hXoAAs62q.jpg,
882992080364220416,This is Rusty. He wasn't ready for the first pic. Clearly puppared for the second. 13/10 confirmed great boy https://t.co/tyER0KpdXj,Rusty,4122,24445,Twitter for iPhone,13.0,10.0,1,Eskimo Dog,"https://twitter.com/dog_rates/status/882992080364220416/photo/1,https://twitter.com/dog_rates/status/882992080364220416/photo/1",https://pbs.twimg.com/media/DEEEnIqXYAAiJh_.jpg,
882762694511734784,This is Gus. He's quite the cheeky pupper. Already perfected the disinterested wink. 12/10 would let steal my girl https://t.co/D43I96SlVu,Gus,5134,28903,Twitter for iPhone,12.0,10.0,1,Labrador Retriever,https://twitter.com/dog_rates/status/882762694511734784/photo/1,https://pbs.twimg.com/media/DEAz_HHXsAA-p_z.jpg,pupper
882627270321602560,This is Stanley. He has his first swim lesson today. Doggle straps adjusted. Ready to go. 13/10 Phelps is nervous (IG: stanleythe_corgi) https://t.co/Nx52PGwH94,Stanley,6342,28382,Twitter for iPhone,13.0,10.0,1,Pembroke,https://twitter.com/dog_rates/status/882627270321602560/photo/1,https://pbs.twimg.com/media/DD-40X3WAAAJPU5.jpg,
882268110199369728,This is Alfy. You're witnessing his first watermelon experience. I think it was a success. 13/10 happy 4th Alfy ðŸ‡ºðŸ‡¸ https://t.co/fYP5RlutfA,Alfy,12118,45880,Twitter for iPhone,13.0,10.0,1,Golden Retriever,"https://twitter.com/dog_rates/status/882268110199369728/photo/1,https://twitter.com/dog_rates/status/882268110199369728/photo/1,https://twitter.com/dog_rates/status/882268110199369728/photo/1",https://pbs.twimg.com/media/DD5yKdPW0AArzX8.jpg,
882045870035918850,"This is Koko. Her owner, inspired by Barney, recently built a cart for her to use during walks if she got tired. 13/10 rest easy Koko https://t.co/zeDpnsKX7w",Koko,5203,29900,Twitter for iPhone,13.0,10.0,1,,"https://twitter.com/dog_rates/status/882045870035918850/photo/1,https://twitter.com/dog_rates/status/882045870035918850/photo/1,https://twitter.com/dog_rates/status/882045870035918850/photo/1,https://twitter.com/dog_rates/status/882045870035918850/photo/1",https://pbs.twimg.com/media/DD2oCl2WAAEI_4a.jpg,
881906580714921986,This is Rey. He's a Benebop Cumberfloof. 12/10 dangerously pettable https://t.co/503CgWbhxQ,Rey,3533,24773,Twitter for iPhone,12.0,10.0,1,Weimaraner,https://twitter.com/dog_rates/status/881906580714921986/photo/1,https://pbs.twimg.com/media/DD0pWm9XcAAeSBL.jpg,
881666595344535552,This is Gary. He couldn't miss this puppertunity for a selfie. Flawless focusing skills. 13/10 would boop intensely https://t.co/7CSWCl8I6s,Gary,11099,51522,Twitter for iPhone,13.0,10.0,1,Saluki,https://twitter.com/dog_rates/status/881666595344535552/photo/1,https://pbs.twimg.com/media/DDxPFwbWAAEbVVR.jpg,
881536004380872706,"Here is a pupper approaching maximum borkdrive. Zooming at never before seen speeds. 14/10 paw-inspiring af 
(IG: puffie_the_chow) https://t.co/ghXBIIeQZF",None,16570,50199,Twitter for iPhone,14.0,10.0,1,Samoyed,https://twitter.com/dog_rates/status/881536004380872706/video/1,https://pbs.twimg.com/ext_tw_video_thumb/881535971568889856/pu/img/9bawiZ--8FKywTkz.jpg,pupper
881268444196462592,Meet Elliot. He's a Canadian Forrest Pup. Unusual number of antlers for a dog. Sneaky tongue slip to celebrate #Canada150. 12/10 would pet https://t.co/cgwJwowTMC,Elliot,5358,23501,Twitter for iPhone,12.0,10.0,1,,https://twitter.com/dog_rates/status/881268444196462592/photo/1,https://pbs.twimg.com/media/DDrk-f9WAAI-WQv.jpg,
880935762899988482,This is Louis. He's crossing. It's a big deal. 13/10 h*ckin breathtaking https://t.co/D0wb1GlKAt,Louis,2886,17346,Twitter for iPhone,13.0,10.0,1,,https://twitter.com/dog_rates/status/880935762899988482/photo/1,https://pbs.twimg.com/media/DDm2Z5aXUAEDS2u.jpg,
880872448815771648,Ugh not again. We only rate dogs. Please don't send in well-dressed  floppy-tongued street penguins. Dogs only please. Thank you... 12/10 https://t.co/WiAMbTkDPf,None,3989,21734,Twitter for iPhone,12.0,10.0,1,Pembroke,https://twitter.com/dog_rates/status/880872448815771648/photo/1,https://pbs.twimg.com/media/DDl8zzJW0AAisCJ.jpg,
880465832366813184,This is Bella. She had her first beach experience this morning. Complete success. 12/10 would perform a sandy boop https://t.co/4VsFysDmiw,Bella,6546,29075,Twitter for iPhone,12.0,10.0,1,Golden Retriever,"https://twitter.com/dog_rates/status/880465832366813184/photo/1,https://twitter.com/dog_rates/status/880465832366813184/photo/1,https://twitter.com/dog_rates/status/880465832366813184/photo/1,https://twitter.com/dog_rates/status/880465832366813184/photo/1",https://pbs.twimg.com/media/DDgK-J4XUAIEV9W.jpg,
880221127280381952,Meet Jesse. He's a Fetty Woof. His tongue ejects without warning. A true bleptomaniac. 12/10 would snug well https://t.co/fUod0tVmvK,Jesse,4436,27640,Twitter for iPhone,12.0,10.0,1,Chihuahua,"https://twitter.com/dog_rates/status/880221127280381952/photo/1,https://twitter.com/dog_rates/status/880221127280381952/photo/1",https://pbs.twimg.com/media/DDcscbXU0AIfDzs.jpg,
880095782870896641,Please don't send in photos without dogs in them. We're not @porch_rates. Insubordinate and churlish. Pretty good porch tho 11/10 https://t.co/HauE8M3Bu4,None,4533,28150,Twitter for iPhone,11.0,10.0,1,Miniature Pinscher,https://twitter.com/dog_rates/status/880095782870896641/photo/1,https://pbs.twimg.com/media/DDa6ckbXgAAM1vV.jpg,
879862464715927552,This is Romeo. He would like to do an entrance. Requesting your immediate assistance. 13/10 https://t.co/Qh5aEkRQm9,Romeo,3642,22667,Twitter for iPhone,13.0,10.0,3,Basset,"https://twitter.com/dog_rates/status/879862464715927552/photo/1,https://twitter.com/dog_rates/status/879862464715927552/photo/1,https://twitter.com/dog_rates/status/879862464715927552/photo/1",https://pbs.twimg.com/media/DDXmPrbWAAEKMvy.jpg,
879492040517615616,This is Bailey. He thinks you should measure ear length for signs of growth instead. 12/10 https://t.co/IxM9IMKQq8,Bailey,3323,23822,Twitter for iPhone,12.0,10.0,1,German Short-Haired Pointer,https://twitter.com/dog_rates/status/879492040517615616/photo/1,https://pbs.twimg.com/media/DDSVWMvXsAEgmMK.jpg,
879415818425184262,This is Duddles. He did an attempt. 13/10 someone help him (vid by Georgia Felici) https://t.co/UDT7ZkcTgY,Duddles,45849,107956,Twitter for iPhone,13.0,10.0,1,English Springer,https://twitter.com/dog_rates/status/879415818425184262/video/1,https://pbs.twimg.com/ext_tw_video_thumb/879415784908390401/pu/img/cX7XI1TnUsseGET5.jpg,
879376492567855104,This is Jack AKA Stephen Furry. You're not scoring on him. Unless he slips down the slide. 12/10 would happily get blocked by https://t.co/0gOi601EAa,Jack,3261,17099,Twitter for iPhone,12.0,10.0,1,,https://twitter.com/dog_rates/status/879376492567855104/photo/1,https://pbs.twimg.com/media/DDQsQGFV0AAw6u9.jpg,
879050749262655488,This is Steven. He has trouble relating to other dogs. Quite shy. Neck longer than average. Tropical probably. 11/10 would still pet https://t.co/2mJCDEJWdD,Steven,4941,23022,Twitter for iPhone,11.0,10.0,1,,https://twitter.com/dog_rates/status/879050749262655488/photo/1,https://pbs.twimg.com/media/DDMD_phXoAQ1qf0.jpg,
879008229531029506,This is Beau. That is Beau's balloon. He takes it everywhere. 13/10 would protect at all costs https://t.co/YDtpCjIPKN,Beau,2812,19317,Twitter for iPhone,13.0,10.0,1,Vizsla,https://twitter.com/dog_rates/status/879008229531029506/photo/1,https://pbs.twimg.com/media/DDLdUrqXYAMOVzY.jpg,
878776093423087618,This is Snoopy. He's a proud #PrideMonthPuppo. Impeccable handwriting for not having thumbs. 13/10 would love back #PrideMonth https://t.co/lNZwgNO4gS,Snoopy,4319,19763,Twitter for iPhone,13.0,10.0,2,Italian Greyhound,"https://twitter.com/dog_rates/status/878776093423087618/photo/1,https://twitter.com/dog_rates/status/878776093423087618/photo/1",https://pbs.twimg.com/media/DDIKMXzW0AEibje.jpg,puppo
878281511006478336,"Meet Shadow. In an attempt to reach maximum zooming borkdrive, he tore his ACL. Still 13/10 tho. Help him out below

https://t.co/245xJJElsY https://t.co/lUiQH219v6",Shadow,1349,7913,Twitter for iPhone,13.0,10.0,1,Basset,"https://www.gofundme.com/3yd6y1c,https://twitter.com/dog_rates/status/878281511006478336/photo/1",https://pbs.twimg.com/media/DDBIX9QVYAAohGa.jpg,
878057613040115712,This is Emmy. She was adopted today. Massive round of pupplause for Emmy and her new family. 14/10 for all involved https://t.co/cwtWnHMVpe,Emmy,7181,42876,Twitter for iPhone,14.0,10.0,1,French Bulldog,"https://twitter.com/dog_rates/status/878057613040115712/photo/1,https://twitter.com/dog_rates/status/878057613040115712/photo/1",https://pbs.twimg.com/media/DC98vABUIAA97pz.jpg,
877736472329191424,This is Aja. She was just told she's a good dog. Suspicions confirmed. 13/10 would tell again https://t.co/lsPyyAiF1r,Aja,17300,71144,Twitter for iPhone,13.0,10.0,2,Chesapeake Bay Retriever,"https://twitter.com/dog_rates/status/877736472329191424/photo/1,https://twitter.com/dog_rates/status/877736472329191424/photo/1",https://pbs.twimg.com/media/DC5YqoQW0AArOLH.jpg,
877556246731214848,This is Penny. She's both pupset and fired pup. Not pleased w your barbaric attempts at cleanliness. 12/10 would enjoy more shampoo options https://t.co/OYdDlfOGXP,Penny,3994,23258,Twitter for iPhone,12.0,10.0,1,Basset,https://twitter.com/dog_rates/status/877556246731214848/photo/1,https://pbs.twimg.com/media/DC20wEcW0AAf59m.jpg,
877316821321428993,"Meet Dante. At first he wasn't a fan of his new raincoat, then he saw his reflection. H*ckin handsome. 13/10 for water resistant good boy https://t.co/SHRTIo5pxc",Dante,5414,27907,Twitter for iPhone,13.0,10.0,1,Saluki,"https://twitter.com/dog_rates/status/877316821321428993/photo/1,https://twitter.com/dog_rates/status/877316821321428993/photo/1",https://pbs.twimg.com/media/DCza_vtXkAQXGpC.jpg,
877201837425926144,This is Nelly. He graduated with his dogtorate today. Wants to know if you're proud of him. 12/10 would give congratulatory boop https://t.co/4g4cfj3P4Y,Nelly,5880,27755,Twitter for iPhone,12.0,10.0,1,Pembroke,"https://twitter.com/dog_rates/status/877201837425926144/photo/1,https://twitter.com/dog_rates/status/877201837425926144/photo/1",https://pbs.twimg.com/media/DCxyahJWsAAddSC.jpg,
