tweet_id,full_text,name,retweet_count,favorite_count,source,normalized_numerator,normalized_denominator,img_num,breed,expanded_urls,jpg_url,dog_stage
718540630683709445,Get you a pup that can do both. 10/10 https://t.co/zSbyvm62xZ,None,1137,2730,Twitter for iPhone,10.0,10.0,2,Maltese Dog,"https://twitter.com/dog_rates/status/718540630683709445/photo/1,https://twitter.com/dog_rates/status/718540630683709445/photo/1",https://pbs.twimg.com/media/CfjE5FRXEAErFWR.jpg,
718460005985447936,Meet Bowie. He's listening for underground squirrels. Smart af. Left eye is considerably magical. 9/10 would so pet https://t.co/JyNmyjy3fe,Bowie,602,2846,Twitter for iPhone,9.0,10.0,1,,https://twitter.com/dog_rates/status/718460005985447936/photo/1,https://pbs.twimg.com/media/Cfh7j6CWQAAndTd.jpg,
718454725339934721,"This pic is old but I hadn't seen it until today and had to share. Creative af. 13/10 very good boy, would pet well https://t.co/4kD16wMA1Z",None,1685,5320,Twitter for iPhone,13.0,10.0,1,,https://twitter.com/dog_rates/status/718454725339934721/photo/1,https://pbs.twimg.com/media/Cfh2w6HWIAIIYAF.jpg,
718246886998687744,This is Alexanderson. He's got a weird ass birth mark. Dreadful at fetch. Won't eat kibble. 3/10 wtf @Target https://t.co/FmxOpf2Sgl,Alexanderson,565,2115,Twitter for iPhone,3.0,10.0,1,Chihuahua,https://twitter.com/dog_rates/status/718246886998687744/photo/1,https://pbs.twimg.com/media/Cfe5tLWXEAIaoFO.jpg,
718234618122661888,This is Suki. She was born with a blurry tail (unfortunate). Next level tongue tho. 11/10 nifty hardwood https://t.co/05S8oYztgb,Suki,1127,4217,Twitter for iPhone,11.0,10.0,1,Malamute,https://twitter.com/dog_rates/status/718234618122661888/photo/1,https://pbs.twimg.com/media/CfeukpmW4AEGjOE.jpg,
717841801130979328,This is Barclay. His father was a banana. 11/10 appeeling af https://t.co/ucOEfr2rjV,Barclay,670,2660,Twitter for iPhone,11.0,10.0,1,Brittany Spaniel,https://twitter.com/dog_rates/status/717841801130979328/photo/1,https://pbs.twimg.com/media/CfZJTphWAAAl5Ys.jpg,
717790033953034240,"Here's a badass mystery pupper. You weren't aware that you owe him money, but you do. 10/10 shades sick af https://t.co/fv9e9AtzSG",None,1272,3170,Twitter for iPhone,10.0,10.0,1,,https://twitter.com/dog_rates/status/717790033953034240/photo/1,https://pbs.twimg.com/media/CfYaOeMWQAAGfyP.jpg,pupper
717537687239008257,People please. This is a Deadly Mediterranean Plop T-Rex. We only rate dogs. Only send in dogs. Thanks you... 11/10 https://t.co/2ATDsgHD4n,None,2069,6281,Twitter for iPhone,11.0,10.0,1,Golden Retriever,https://twitter.com/dog_rates/status/717537687239008257/photo/1,https://pbs.twimg.com/media/CfU0t75W4AAUo9V.jpg,
717421804990701568,This is Ebby. She's a Zimbabwean Feta. Embarrassed by ridiculously squishy face. 9/10 would squeeze softly https://t.co/LBJqxMGaHi,Ebby,945,3446,Twitter for iPhone,9.0,10.0,2,Miniature Pinscher,"https://twitter.com/dog_rates/status/717421804990701568/photo/1,https://twitter.com/dog_rates/status/717421804990701568/photo/1",https://pbs.twimg.com/media/CfTLUYWXEAEkyES.jpg,
717047459982213120,This is FlÃ¡vio (pronounced Baxter). He's a Benesnoop Cumberdog. Super rare. Symmetrical. 12/10 would pet so well https://t.co/fGgleFiBPq,FlÃ¡vio,2135,6826,Twitter for iPhone,12.0,10.0,1,Golden Retriever,https://twitter.com/dog_rates/status/717047459982213120/photo/1,https://pbs.twimg.com/media/CfN23ArXEAEkZkz.jpg,
717009362452090881,This is Smokey. He's having some sort of existential crisis. 10/10 hang in there pupper https://t.co/JmgF4dMpw0,Smokey,1102,3583,Twitter for iPhone,10.0,10.0,1,Siberian Husky,https://twitter.com/dog_rates/status/717009362452090881/photo/1,https://pbs.twimg.com/media/CfNUNetW8AAekHx.jpg,pupper
716802964044845056,This is Link. He struggles with couches. 10/10 would assist https://t.co/SbX4e6Yg3o,Link,1317,4627,Twitter for iPhone,10.0,10.0,2,Malinois,"https://twitter.com/dog_rates/status/716802964044845056/photo/1,https://twitter.com/dog_rates/status/716802964044845056/photo/1",https://pbs.twimg.com/media/CfKYfeBXIAAopp2.jpg,
716791146589110272,Meet Jennifur. She's supposed to be navigating. Not even buckled up. Insubordinate &amp; churlish. 11/10 would still pet https://t.co/h0trcJohYO,Jennifur,1474,5204,Twitter for iPhone,11.0,10.0,1,Pomeranian,https://twitter.com/dog_rates/status/716791146589110272/photo/1,https://pbs.twimg.com/media/CfKNvU8WsAAvI9Z.jpg,
716439118184652801,This is Bluebert. He just saw that both #FinalFur match ups are split 50/50. Amazed af. 11/10 https://t.co/Kky1DPG4iq,Bluebert,247,2574,Twitter for iPhone,11.0,10.0,1,Siberian Husky,https://twitter.com/dog_rates/status/716439118184652801/photo/1,https://pbs.twimg.com/media/CfFNk7cWAAA-hND.jpg,
716285507865542656,This is Stephanus. She stays woke. 12/10 https://t.co/WIWabMngQZ,Stephanus,1225,3041,Twitter for iPhone,12.0,10.0,1,Yorkshire Terrier,"https://twitter.com/dog_rates/status/716285507865542656/photo/1,https://twitter.com/dog_rates/status/716285507865542656/photo/1",https://pbs.twimg.com/media/CfDB3aJXEAAEZNv.jpg,
716080869887381504,Here's a super majestic doggo and a sunset 11/10 https://t.co/UACnoyi8zu,None,1935,5272,Twitter for iPhone,11.0,10.0,1,Golden Retriever,"https://twitter.com/dog_rates/status/716080869887381504/photo/1,https://twitter.com/dog_rates/status/716080869887381504/photo/1",https://pbs.twimg.com/media/CfAHv83UMAIEQYx.jpg,doggo
715928423106027520,This is Bubbles. He's a Yorkshire Piccolope. 11/10 would snug aggressively https://t.co/3BhMojONxq,Bubbles,987,3485,Twitter for iPhone,11.0,10.0,1,Pug,https://twitter.com/dog_rates/status/715928423106027520/photo/1,https://pbs.twimg.com/media/Ce99GhLW8AAHG38.jpg,
715733265223708672,This is a taco. We only rate dogs. Please only send in dogs. Dogs are what we rate. Not tacos. Thank you... 10/10 https://t.co/cxl6xGY8B9,None,1920,5093,Twitter for iPhone,10.0,10.0,1,Dandie Dinmont,https://twitter.com/dog_rates/status/715733265223708672/photo/1,https://pbs.twimg.com/media/Ce7LlUeUUAEQkQl.jpg,
715696743237730304,Meet Toby. He's a Lithuanian High-Steppin Stickeroo. One of the more accomplished Stickeroos around. 10/10 so nifty https://t.co/cYPHuJYTjC,Toby,1454,4257,Twitter for iPhone,10.0,10.0,1,Staffordshire Bullterrier,https://twitter.com/dog_rates/status/715696743237730304/photo/1,https://pbs.twimg.com/media/Ce6qZC2WAAAcSoI.jpg,
715680795826982913,This is Zeus. He's downright fabulous. 12/10 https://t.co/sSugyyRuTp,Zeus,1813,4719,Twitter for iPhone,12.0,10.0,1,Golden Retriever,"https://twitter.com/dog_rates/status/715680795826982913/photo/1,https://twitter.com/dog_rates/status/715680795826982913/photo/1,https://twitter.com/dog_rates/status/715680795826982913/photo/1",https://pbs.twimg.com/media/Ce6b4MPWwAA22Xm.jpg,
715360349751484417,This is Bertson. He just wants to say hi. 11/10 would boop nose https://t.co/hwv7Wq6gDA,Bertson,1772,5955,Twitter for iPhone,11.0,10.0,1,,https://twitter.com/dog_rates/status/715360349751484417/photo/1,https://pbs.twimg.com/media/Ce14cOvWwAAcFJH.jpg,
715342466308784130,This is Oscar. He's a world renowned snowball inspector. It's a ruff job but someone has to do it. 10/10 great guy https://t.co/vSufMAKm3C,Oscar,768,3294,Twitter for iPhone,10.0,10.0,1,West Highland White Terrier,"https://twitter.com/dog_rates/status/715342466308784130/photo/1,https://twitter.com/dog_rates/status/715342466308784130/photo/1",https://pbs.twimg.com/media/Ce1oLNqWAAE34w7.jpg,
715220193576927233,This is Nico. His selfie game is strong af. Excellent use of a sneaky tongue slip. 10/10 star material https://t.co/1OBdJkMOFx,Nico,736,2630,Twitter for iPhone,10.0,10.0,1,Chihuahua,https://twitter.com/dog_rates/status/715220193576927233/photo/1,https://pbs.twimg.com/media/Cez49UqWsAIRQXc.jpg,
715200624753819648,This is Michelangelope. He's half coffee cup. Rare af. 12/10 would hug until someone stopped me https://t.co/tvVDY0G911,Michelangelope,2110,5578,Twitter for iPhone,12.0,10.0,1,Chihuahua,https://twitter.com/dog_rates/status/715200624753819648/photo/1,https://pbs.twimg.com/media/CeznK6IWEAEFUPq.jpg,
715009755312439296,This is Siba. She's remarkably mobile. Very sleepy as well. 12/10 would happily transport https://t.co/TjnI33RE1i,Siba,1392,4550,Twitter for iPhone,12.0,10.0,1,,https://twitter.com/dog_rates/status/715009755312439296/photo/1,https://pbs.twimg.com/media/Cew5kyOWsAA8Y_o.jpg,
714982300363173890,This is Calbert. He forgot to clear his Google search history. 9/10 rookie mistake Calbert https://t.co/jRm5J3YCmj,Calbert,1166,4094,Twitter for iPhone,9.0,10.0,1,Brittany Spaniel,https://twitter.com/dog_rates/status/714982300363173890/photo/1,https://pbs.twimg.com/media/CewgnHAXEAAdbld.jpg,
714957620017307648,This is Curtis. He's an Albino Haberdasher. Terrified of dandelions. They really spook him up. 10/10 it'll be ok pup https://t.co/s8YcfZrWhK,Curtis,1595,4503,Twitter for iPhone,10.0,10.0,1,Great Pyrenees,https://twitter.com/dog_rates/status/714957620017307648/photo/1,https://pbs.twimg.com/media/CewKKiOWwAIe3pR.jpg,
714631576617938945,This is Benedict. He's a feisty pup. Needs a brushing. Portable af. Looks very angry actually. 4/10 might not pet https://t.co/3oeFfHjv0Z,Benedict,1122,3571,Twitter for iPhone,4.0,10.0,1,,https://twitter.com/dog_rates/status/714631576617938945/photo/1,https://pbs.twimg.com/media/CerhoBWWAAA5eLL.jpg,
714606013974974464,Here are two lil cuddly puppers. Both 12/10 would snug like so much https://t.co/zO4eb7C4tG,None,1038,3938,Twitter for iPhone,12.0,10.0,1,Norfolk Terrier,https://twitter.com/dog_rates/status/714606013974974464/photo/1,https://pbs.twimg.com/media/CerKYG8WAAM1aE-.jpg,
714258258790387713,"Meet Travis and Flurp. Travis is pretty chill but Flurp can't lie down properly. 10/10 &amp; 8/10
get it together Flurp https://t.co/Akzl5ynMmE",Travis,808,3281,Twitter for iPhone,10.0,10.0,1,Collie,https://twitter.com/dog_rates/status/714258258790387713/photo/1,https://pbs.twimg.com/media/CemOGNjWQAEoN7R.jpg,
714251586676113411,This is Thumas. He hates potted plants. 8/10 wtf Thumas https://t.co/rDVueNIcEi,Thumas,940,3570,Twitter for iPhone,8.0,10.0,2,Soft-Coated Wheaten Terrier,"https://twitter.com/dog_rates/status/714251586676113411/photo/1,https://twitter.com/dog_rates/status/714251586676113411/photo/1",https://pbs.twimg.com/media/CemIBt4WwAQqhVV.jpg,
714214115368108032,Happy Easter from the squad! ðŸ‡ðŸ¶ 13/10 for all https://t.co/YMx4KWJUAB,None,990,2480,Twitter for iPhone,13.0,10.0,1,Pug,https://twitter.com/dog_rates/status/714214115368108032/photo/1,https://pbs.twimg.com/media/Cell8ikWIAACCJ-.jpg,
714141408463036416,"I know we only rate dogs, but since it's Easter I guess we could rate a bunny for a change. 10/10 petable as hell https://t.co/O2RlKXigHu",None,1569,4673,Twitter for iPhone,10.0,10.0,1,Labrador Retriever,https://twitter.com/dog_rates/status/714141408463036416/photo/1,https://pbs.twimg.com/media/Cekj0qwXEAAHcS6.jpg,
713919462244790272,This is Kanu. He's a Freckled Ticonderoga. Simply flawless. 12/10 would perform an elaborate heist to capture https://t.co/7vyAzIURrE,Kanu,869,3564,Twitter for iPhone,12.0,10.0,1,Siberian Husky,https://twitter.com/dog_rates/status/713919462244790272/photo/1,https://pbs.twimg.com/media/CehZ9mLWsAAsn28.jpg,
713900603437621249,Happy Saturday here's 9 puppers on a bench. 99/90 good work everybody https://t.co/mpvaVxKmc1,None,829,3062,Twitter for iPhone,11.0,10.0,1,Golden Retriever,https://twitter.com/dog_rates/status/713900603437621249/photo/1,https://pbs.twimg.com/media/CehIzzZWQAEyHH5.jpg,
713761197720473600,This is Piper. She would really like that tennis ball core. Super sneaky tongue slip. 12/10 precious af https://t.co/QP6GHi5az9,Piper,1541,5308,Twitter for iPhone,12.0,10.0,1,Brittany Spaniel,"https://twitter.com/dog_rates/status/713761197720473600/photo/1,https://twitter.com/dog_rates/status/713761197720473600/photo/1",https://pbs.twimg.com/media/CefKBOuWIAAIlKD.jpg,
713411074226274305,Here we see an extremely rare Bearded Floofmallow. Only a few left in the wild. 11/10 would pet with a purpose https://t.co/jVJJKlPbvq,None,1440,4802,Twitter for iPhone,11.0,10.0,1,Great Pyrenees,https://twitter.com/dog_rates/status/713411074226274305/photo/1,https://pbs.twimg.com/media/CeaLlAPUMAIcC7U.jpg,
713177543487135744,This is Lance. Lance doesn't give a shit. 10/10 we should all be more like Lance https://t.co/SqnG9Ap28J,Lance,3183,7854,Twitter for iPhone,10.0,10.0,1,Whippet,https://twitter.com/dog_rates/status/713177543487135744/photo/1,https://pbs.twimg.com/media/CeW3MWMWQAEOMbq.jpg,
713175907180089344,Say hello to Opie and Clarkus. Clarkus fell asleep so Opie buried him. Ruthless af 10/10 for both https://t.co/xT7XaY4gnW,Opie,1630,4851,Twitter for iPhone,10.0,10.0,1,,https://twitter.com/dog_rates/status/713175907180089344/photo/1,https://pbs.twimg.com/media/CeW1tERWAAAA9Q2.jpg,
712809025985978368,This is Stubert. He just arrived. 10/10 https://t.co/HVGs5aAKAn,Stubert,7602,20378,Twitter for iPhone,10.0,10.0,1,Labrador Retriever,https://twitter.com/dog_rates/status/712809025985978368/photo/1,https://pbs.twimg.com/media/CeRoBaxWEAABi0X.jpg,
712717840512598017,Please don't send in any more polar bears. We only rate dogs. Thank you... 10/10 https://t.co/83RGhdIQz2,None,5616,13474,Twitter for iPhone,10.0,10.0,1,Great Pyrenees,https://twitter.com/dog_rates/status/712717840512598017/photo/1,https://pbs.twimg.com/media/CeQVF1eVIAAJaTv.jpg,
712668654853337088,Say hello to Sunny and Roxy. They pull things out of water together. 10/10 for both https://t.co/88aedAmxcl,Sunny,1367,4531,Twitter for iPhone,10.0,10.0,1,Labrador Retriever,"https://twitter.com/dog_rates/status/712668654853337088/photo/1,https://twitter.com/dog_rates/status/712668654853337088/photo/1,https://twitter.com/dog_rates/status/712668654853337088/photo/1",https://pbs.twimg.com/media/CePoVTyWsAQEz1g.jpg,
712438159032893441,This is Kane. He's a semi-submerged Haitian Huffleplop. Happy af. Sick waterfall. 11/10 would pat head approvingly https://t.co/7zjEC501Ul,Kane,1756,5799,Twitter for iPhone,11.0,10.0,1,,https://twitter.com/dog_rates/status/712438159032893441/photo/1,https://pbs.twimg.com/media/CeMWubMWwAA6GwF.jpg,
712097430750289920,I can't even comprehend how confused this dog must be right now. 10/10 https://t.co/8AGcQ4hIfK,None,1172,4144,Twitter for iPhone,10.0,10.0,1,Labrador Retriever,https://twitter.com/dog_rates/status/712097430750289920/photo/1,https://pbs.twimg.com/media/CeHg1klW8AE4YOB.jpg,
712092745624633345,This is Steven. He's inverted af. Also very helpful. Scans anything you want for free. Takes him a while tho. 7/10 https://t.co/tA0ZiQ7JcG,Steven,1016,3211,Twitter for iPhone,7.0,10.0,1,,https://twitter.com/dog_rates/status/712092745624633345/photo/1,https://pbs.twimg.com/media/CeHckpuW4AAF7rT.jpg,
712085617388212225,"Say hello to Olive and Ruby. They are best buddies. Both 11/10 
1 like = 1 buddy https://t.co/yagmFdKlyL",Olive,556,3531,Twitter for iPhone,11.0,10.0,2,Shih-Tzu,"https://twitter.com/dog_rates/status/712085617388212225/photo/1,https://twitter.com/dog_rates/status/712085617388212225/photo/1,https://twitter.com/dog_rates/status/712085617388212225/photo/1",https://pbs.twimg.com/media/CeHWFksXIAAyypp.jpg,
712065007010385924,This is Chester. He's clearly in charge of the other dogs. Weird ass paws. Not fit for fetch. 6/10 would still pet https://t.co/o2GvskrhHt,Chester,700,2451,Twitter for iPhone,6.0,10.0,1,,https://twitter.com/dog_rates/status/712065007010385924/photo/1,https://pbs.twimg.com/media/CeHDV73W0AM5Cf8.jpg,
711968124745228288,Meet Winston. He's trapped in a cup of coffee. Poor pupper. 10/10 someone free him https://t.co/2e6cUtKUuc,Winston,2601,8776,Twitter for iPhone,10.0,10.0,1,,https://twitter.com/dog_rates/status/711968124745228288/photo/1,https://pbs.twimg.com/media/CeFrO3qXEAADRbd.jpg,pupper
711743778164514816,Meet Roosevelt. He's calculating the best case scenario if he drops out instead of doing math hw. 11/10 relatable af https://t.co/QcSIRDpfVg,Roosevelt,1101,3095,Twitter for iPhone,11.0,10.0,1,Lakeland Terrier,https://twitter.com/dog_rates/status/711743778164514816/photo/1,https://pbs.twimg.com/media/CeCfMPDW0AAAEUj.jpg,
711732680602345472,I want to hear the joke this dog was just told. 10/10 https://t.co/1KiuZqqOD4,None,4653,9756,Twitter for iPhone,10.0,10.0,3,,"https://twitter.com/dog_rates/status/711732680602345472/photo/1,https://twitter.com/dog_rates/status/711732680602345472/photo/1,https://twitter.com/dog_rates/status/711732680602345472/photo/1",https://pbs.twimg.com/media/CeCVGEbUYAASeY4.jpg,
711694788429553666,Oh. My. God. 13/10 magical af https://t.co/Ezu6jQrKAZ,None,20500,35865,Twitter for iPhone,13.0,10.0,1,,https://twitter.com/dog_rates/status/711694788429553666/photo/1,https://pbs.twimg.com/tweet_video_thumb/CeBym7oXEAEWbEg.jpg,
711652651650457602,This is Gary. He just wanted to say hi. 9/10 very personable pup https://t.co/Sk3CbhmKSW,Gary,1037,4228,Twitter for iPhone,9.0,10.0,1,,https://twitter.com/dog_rates/status/711652651650457602/photo/1,https://pbs.twimg.com/media/CeBMT6-WIAA7Qqf.jpg,
711363825979756544,"""Please, no puparazzi"" 11/10 https://t.co/nJIXSPfedK",None,1287,3996,Twitter for iPhone,11.0,10.0,1,Pembroke,"https://twitter.com/dog_rates/status/711363825979756544/photo/1,https://twitter.com/dog_rates/status/711363825979756544/photo/1",https://pbs.twimg.com/media/Cd9Fn5QUMAAYMT4.jpg,
711306686208872448,What hooligan sent in pictures w/out a dog in them? Churlish af. 3/10 just bc that's a neat fluffy bean bag chair https://t.co/wcwoGOkZvz,None,819,3596,Twitter for iPhone,3.0,10.0,1,,"https://twitter.com/dog_rates/status/711306686208872448/photo/1,https://twitter.com/dog_rates/status/711306686208872448/photo/1",https://pbs.twimg.com/media/Cd8Rpl0W0AAN1kU.jpg,
711008018775851008,This is Chuckles. He had a balloon but he accidentally let go of it and it floated away. 11/10 hang in there pupper https://t.co/68iNM7B5gW,Chuckles,710,3275,Twitter for iPhone,11.0,10.0,1,French Bulldog,https://twitter.com/dog_rates/status/711008018775851008/photo/1,https://pbs.twimg.com/media/Cd4CBQFW8AAY3ND.jpg,pupper
710997087345876993,Meet Milo and Amos. They are the best of pals. Both 12/10 would pet at the same time https://t.co/Mv37BHEyyD,Milo,1561,4960,Twitter for iPhone,12.0,10.0,1,Malamute,https://twitter.com/dog_rates/status/710997087345876993/photo/1,https://pbs.twimg.com/media/Cd34FClUMAAnvGP.jpg,
710844581445812225,This is Staniel. His selfie game is strong af. 10/10 I'd snapchat with Staniel https://t.co/UgkTw7TKyM,Staniel,779,2775,Twitter for iPhone,10.0,10.0,1,,https://twitter.com/dog_rates/status/710844581445812225/photo/1,https://pbs.twimg.com/media/Cd1tYGmXIAAoW5b.jpg,
710833117892898816,Say hello to Sora. She's an Egyptian Pumpernickel. Mesmerizing af. 12/10 would bring home to mom https://t.co/PmTR4kxZkq,Sora,606,2937,Twitter for iPhone,12.0,10.0,1,Pembroke,https://twitter.com/dog_rates/status/710833117892898816/photo/1,https://pbs.twimg.com/media/Cd1i8qvUkAE-Jlr.jpg,
710658690886586372,Here's a brigade of puppers. All look very prepared for whatever happens next. 80/80 https://t.co/0eb7R1Om12,None,636,2529,Twitter for iPhone,10.0,10.0,1,Soft-Coated Wheaten Terrier,https://twitter.com/dog_rates/status/710658690886586372/photo/1,https://pbs.twimg.com/media/CdzETn4W4AAVU5N.jpg,
710588934686908417,This is Beemo. He's a Chubberflop mix. 12/10 would cross the world for https://t.co/kzMVMU8HBV,Beemo,2107,4968,Twitter for iPhone,12.0,10.0,4,Pembroke,"https://twitter.com/dog_rates/status/710588934686908417/photo/1,https://twitter.com/dog_rates/status/710588934686908417/photo/1,https://twitter.com/dog_rates/status/710588934686908417/photo/1,https://twitter.com/dog_rates/status/710588934686908417/photo/1",https://pbs.twimg.com/media/CdyE2x1W8AAe0TG.jpg,
710283270106132480,This is Gunner. He's a Figamus Newton. King of the peek-a-boo. Cool jeans. 11/10 https://t.co/ONuBILIYXZ,Gunner,580,2308,Twitter for iPhone,11.0,10.0,2,Shih-Tzu,"https://twitter.com/dog_rates/status/710283270106132480/photo/1,https://twitter.com/dog_rates/status/710283270106132480/photo/1",https://pbs.twimg.com/media/Cdtu3WRUkAAsRVx.jpg,
710272297844797440,We ðŸ‘ðŸ» only ðŸ‘ðŸ» rate ðŸ‘ðŸ» dogs. Pls stop sending in non-canines like this Dutch Panda Worm. This is infuriating. 11/10 https://t.co/odfLzBonG2,None,1425,4945,Twitter for iPhone,11.0,10.0,1,Old English Sheepdog,https://twitter.com/dog_rates/status/710272297844797440/photo/1,https://pbs.twimg.com/media/Cdtk414WoAIUG0v.jpg,
710269109699739648,"The squad is back for St. Patrick's Day! â˜˜ ðŸ’š
13/10 for all https://t.co/OcCDb2bng5",None,1257,2613,Twitter for iPhone,13.0,10.0,1,Pug,https://twitter.com/dog_rates/status/710269109699739648/photo/1,https://pbs.twimg.com/media/Cdth_KyWEAEXH3u.jpg,
710153181850935296,This is Lacy. She's tipping her hat to you. Daydreams of her life back on the frontier. 11/10 would pet so well https://t.co/fG5Pk3Et1I,Lacy,1006,3153,Twitter for iPhone,11.0,10.0,2,,"https://twitter.com/dog_rates/status/710153181850935296/photo/1,https://twitter.com/dog_rates/status/710153181850935296/photo/1",https://pbs.twimg.com/media/Cdr4jO2UAAAIo6W.jpg,
710140971284037632,This is Tater. His underbite is fierce af. Doesn't give a damn about your engagement photo. 8/10 https://t.co/nLuPY3pY12,Tater,1008,3017,Twitter for iPhone,8.0,10.0,1,Pekinese,https://twitter.com/dog_rates/status/710140971284037632/photo/1,https://pbs.twimg.com/media/Cdrtcr-W4AAqi5H.jpg,
710117014656950272,This pupper got her hair chalked for her birthday. Hasn't told her parents yet. Rebellious af. 11/10 very nifty https://t.co/h1OX2mLtxV,None,2233,5999,Twitter for iPhone,11.0,10.0,2,Toy Poodle,"https://twitter.com/dog_rates/status/710117014656950272/photo/1,https://twitter.com/dog_rates/status/710117014656950272/photo/1",https://pbs.twimg.com/media/CdrXp9dWoAAcRfn.jpg,pupper
709918798883774466,Meet Watson. He's a Suzuki Tickleboop. Leader of a notorious biker gang. Only one ear functional. 12/10 snuggable af https://t.co/R1gLc5vDqG,Watson,1215,3250,Twitter for iPhone,12.0,10.0,2,Pembroke,"https://twitter.com/dog_rates/status/709918798883774466/photo/1,https://twitter.com/dog_rates/status/709918798883774466/photo/1",https://pbs.twimg.com/media/CdojYQmW8AApv4h.jpg,
709901256215666688,"WeRateDogs stickers are here and they're 12/10! Use code ""puppers"" at checkout ðŸ¶ðŸ¾

Shop now: https://t.co/k5xsufRKYm https://t.co/ShXk46V13r",None,112,732,Twitter for iPhone,12.0,10.0,2,,"http://goo.gl/ArWZfi,https://twitter.com/dog_rates/status/709901256215666688/photo/1,https://twitter.com/dog_rates/status/709901256215666688/photo/1,https://twitter.com/dog_rates/status/709901256215666688/photo/1,https://twitter.com/dog_rates/status/709901256215666688/photo/1",https://pbs.twimg.com/media/CdoTbL_XIAAitq2.jpg,
709852847387627521,*lets out a tiny whimper and then collapses* ...12/10 https://t.co/BNdVZEHRow,None,1336,3824,Twitter for iPhone,12.0,10.0,2,Chihuahua,"https://twitter.com/dog_rates/status/709852847387627521/photo/1,https://twitter.com/dog_rates/status/709852847387627521/photo/1,https://twitter.com/dog_rates/status/709852847387627521/photo/1,https://twitter.com/dog_rates/status/709852847387627521/photo/1",https://pbs.twimg.com/media/CdnnZhhWAAEAoUc.jpg,
709566166965075968,This is Olaf. He's gotta be rare. Seems sturdy. Tail is floofy af. 12/10 would do whatever it takes to pet https://t.co/E9jaU59bh9,Olaf,1367,3865,Twitter for iPhone,12.0,10.0,1,Chow,https://twitter.com/dog_rates/status/709566166965075968/photo/1,https://pbs.twimg.com/media/Cdjiqi6XIAIUOg-.jpg,
709556954897764353,This is Cecil. She's a Gigglefloof Poofer. Outdoorsy af. One with nature. 12/10 would strategically capture https://t.co/ijJB0DuOIC,Cecil,1204,3593,Twitter for iPhone,12.0,10.0,2,Golden Retriever,"https://twitter.com/dog_rates/status/709556954897764353/photo/1,https://twitter.com/dog_rates/status/709556954897764353/photo/1,https://twitter.com/dog_rates/status/709556954897764353/photo/1",https://pbs.twimg.com/media/CdjaSFCWAAAJZh3.jpg,
709519240576036864,This is Vince. He's a Gregorian Flapjeck. White spot on legs almost looks like another dog (whoa). 9/10 rad as hell https://t.co/aczGAV2dK4,Vince,277,1620,Twitter for iPhone,9.0,10.0,1,Cocker Spaniel,https://twitter.com/dog_rates/status/709519240576036864/photo/1,https://pbs.twimg.com/media/Cdi3-f7W8AUOm9T.jpg,
709449600415961088,Meet Karma. She's just a head. Lost body during the Second Punic War (unfortunate). Loves to travel 10/10 petable af https://t.co/c6af6nYEPo,Karma,665,2420,Twitter for iPhone,10.0,10.0,2,Maltese Dog,"https://twitter.com/dog_rates/status/709449600415961088/photo/1,https://twitter.com/dog_rates/status/709449600415961088/photo/1",https://pbs.twimg.com/media/Cdh4pgAW0AEKJ_a.jpg,
709409458133323776,This is Billy. He sensed a squirrel. 8/10 damn it Billy https://t.co/Yu0K98VZ9A,Billy,788,2855,Twitter for iPhone,8.0,10.0,1,Shetland Sheepdog,https://twitter.com/dog_rates/status/709409458133323776/photo/1,https://pbs.twimg.com/media/CdhUIMSUIAA4wYK.jpg,
709225125749587968,This is Walker. He's a Butternut Khalifa. Appears fuzzy af. 11/10 would hug for a ridiculous amount of time https://t.co/k6fEWHSALn,Walker,647,2615,Twitter for iPhone,11.0,10.0,1,Labrador Retriever,https://twitter.com/dog_rates/status/709225125749587968/photo/1,https://pbs.twimg.com/media/Cdese-zWEAArIqE.jpg,
709207347839836162,This is Penny. She's trying on her prom dress. Stunning af 11/10 https://t.co/qcZDZGCapg,Penny,6567,13755,Twitter for iPhone,11.0,10.0,1,Chihuahua,https://twitter.com/dog_rates/status/709207347839836162/photo/1,https://pbs.twimg.com/media/CdecUSzUIAAHCvg.jpg,
709198395643068416,"From left to right:
Cletus, Jerome, Alejandro, Burp, &amp; Titson
None know where camera is. 45/50 would hug all at once https://t.co/sedre1ivTK",None,721,2634,Twitter for iPhone,9.0,10.0,1,Borzoi,https://twitter.com/dog_rates/status/709198395643068416/photo/1,https://pbs.twimg.com/media/CdeUKpcWoAAJAWJ.jpg,
